{
  "_schema": "comment",
  "_id": "3fa85f64-5717-4562-b3fc-2c963f66afa6",
  "_org": "123",
  "_title": "John Doe",
  "_tags": [
    "family:label"
  ],
  "content": "string",
  "note_number": "string",
  "created_by": {
    "id": "string",
    "organization_id": "123",
    "email": "user@example.com",
    "display_name": "John Doe",
    "name": "John Doe",
    "preferred_language": "de",
    "signature": "<p>Best regards,<br/>John Doe</p>",
    "roles": [
      "Owner"
    ],
    "image_uri": {
      "original": "https://account-profile-images.epilot.cloud/1/avatar.png",
      "thumbnail_32": "https://account-profile-images.epilot.cloud/1/avatar_32x32.png"
    },
    "properties": [
      {
        "name": "profileImageName",
        "value": "avatar.png"
      }
    ]
  },
  "context_entities": {
    "$relation": [
      {
        "entity_id": "123e4567-e89b-12d3-a456-426614174000",
        "_tags": [
          "example"
        ]
      }
    ]
  },
  "parent": {
    "$relation": [
      {
        "entity_id": "123e4567-e89b-12d3-a456-426614174000",
        "_tags": [
          "example"
        ]
      }
    ]
  },
  "attachments": {
    "$relation": [
      {
        "entity_id": "123e4567-e89b-12d3-a456-426614174000",
        "_tags": [
          "example"
        ]
      }
    ]
  },
  "contexts": {
    "$relation": [
      {
        "entity_id": "123e4567-e89b-12d3-a456-426614174000",
        "_tags": [
          "example"
        ]
      }
    ]
  },
  "type": "internal_communication",
  "onsite_visit_address": "string",
  "onsite_visit_date_and_time": "1970-01-01T00:00:00.000Z",
  "phone_protocol_call_direction": "inbound",
  "phone_protocol_call_type": "cold_call",
  "phone_protocol_call_outcome": "busy",
  "phone_protocol_date_and_time": "1970-01-01T00:00:00.000Z",
  "personal_consultation_duration": "less_than_30_minutes",
  "personal_consultation_date_and_time": "1970-01-01T00:00:00.000Z",
  "_files": {
    "$relation": [
      {
        "entity_id": "123e4567-e89b-12d3-a456-426614174000",
        "_tags": [
          "example"
        ]
      }
    ]
  },
  "_created_at": "1970-01-01T00:00:00.000Z",
  "_updated_at": "1970-01-01T00:00:00.000Z",
  "_owners": [
    {
      "org_id": "123",
      "user_id": "456"
    }
  ],
  "_acl": {
    "view": [
      "org:456"
    ],
    "edit": [
      "org:456"
    ],
    "delete": [
      "org:456"
    ]
  },
  "_manifest": [
    "123e4567-e89b-12d3-a456-426614174000"
  ]
}